<?xml version="1.0" encoding="utf-8"?>
<!DOCTYPE arbre SYSTEM "arbre.dtd">
<arbre>
  <A>
    <!-- ====================================================== -->
    <!-- ====================================================== -->
    <B>
      <!-- ====================================================== -->
      <C><D /></C> 
      <F />
      <!-- ====================================================== -->
      <C></C>  
      <F />
      <!-- ====================================================== -->
      <C><D /></C>
      <F />
      <!-- ====================================================== -->
    </B>
    <!-- ====================================================== -->
    <!-- ====================================================== -->
    <E>
      <!-- ====================================================== -->
      <D />
      <!-- ====================================================== -->
      <C><D /></C>
      <!-- ====================================================== -->
      <C></C>
      <!-- ====================================================== -->
    </E>
  </A>
</arbre>